{
  "$schema": "https://json-schema.org/draft/2020-12/schema",
  "$id": "https://coga.dev/schemas/asset-assessment.v0.1.json",
  "title": "COGA asset assessment",
  "type": "object",
  "additionalProperties": false,
  "required": [
    "summary",
    "changeClasses",
    "risks",
    "questions",
    "recommendedScenarios",
    "recommendation",
    "confidence"
  ],
  "properties": {
    "summary": { "type": "string", "minLength": 1, "maxLength": 2000 },
    "changeClasses": {
      "type": "array",
      "minItems": 1,
      "uniqueItems": true,
      "items": {
        "enum": [
          "authority-changed",
          "scope-expanded",
          "scope-narrowed",
          "permission-expanded",
          "permission-narrowed",
          "failure-behavior-changed",
          "contract-changed",
          "provenance-changed",
          "editorial",
          "uncertain"
        ]
      }
    },
    "risks": {
      "type": "array",
      "maxItems": 20,
      "items": {
        "type": "object",
        "additionalProperties": false,
        "required": ["severity", "description", "mitigation"],
        "properties": {
          "severity": { "enum": ["low", "medium", "high", "critical"] },
          "description": {
            "type": "string",
            "minLength": 1,
            "maxLength": 1000
          },
          "mitigation": { "type": "string", "minLength": 1, "maxLength": 1000 }
        }
      }
    },
    "questions": {
      "type": "array",
      "maxItems": 20,
      "items": { "type": "string", "minLength": 1, "maxLength": 1000 }
    },
    "recommendedScenarios": {
      "type": "array",
      "maxItems": 30,
      "uniqueItems": true,
      "items": { "type": "string", "minLength": 1, "maxLength": 160 }
    },
    "recommendation": { "enum": ["ready", "revise", "reject"] },
    "confidence": { "type": "number", "minimum": 0, "maximum": 1 }
  }
}
